<?xml version="1.0" encoding="UTF-8"?>
<suggested-addon-candidates xmlns:xsi="http://www.w3.org/2001/XMLSchema-instance"
	xmlns:suggested-addon-candidates="https://openhab.org/schemas/suggested-addon-candidates/v1.0.0"
	xsi:schemaLocation="https://openhab.org/schemas/suggested-addon-candidates/v1.0.0 https://openhab.org/schemas/suggested-addon-candidates-1.0.0.xsd">

	<candidate>
		<addon-uid>binding.hpprinter</addon-uid>
		<discovery-method>
			<service-type>mdns</service-type>
			<match-property>
				<name>rp</name>
				<regex>.*</regex>
			</match-property>
			<match-property>
				<name>ty</name>
				<regex>hp (.*)</regex>
			</match-property>
			<mdns-service-type>_printer._tcp.local.</mdns-service-type>
		</discovery-method>
	</candidate>
	<candidate>
		<addon-uid>binding.hue</addon-uid>
		<discovery-method>
			<service-type>upnp</service-type>
			<match-property>
				<name>modelName</name>
				<regex>Philips hue bridge</regex>
			</match-property>
		</discovery-method>
		<discovery-method>
			<service-type>mdns</service-type>
			<mdns-service-type>_hue._tcp.local.</mdns-service-type>
		</discovery-method>
	</candidate>
</suggested-addon-candidates>
